,num,Id,ProductId,UserId,ProfileName,HelpfulnessNumerator,HelpfulnessDenominator,Score,Time,Summary,Text,weight
804,408621,408622,B000FDDET6,A3LCKU7LIE45ZM,"Snow ""YKA""",2,8,1,1255996800,Dosen't rise well,"I tried 3 times this bread mix, it dosen't rise and taste not so good.",1.2193337560357022e-05
114,186974,186975,B003AO9784,A2LFJS82CC1BTW,Shell,1,1,1,1295568000,Not very good,"Doesn't taste like bubblegum, or anything else I've tasted.  Gave them another try and ordered the cotton candy, a little better.  Going to try a different brand.",1.2193337560357022e-05
336,99121,99122,B001CHH51W,A297TUCWLZIKZF,"T. K. Lovett ""Music...Wine...A Book...Perfect!""",3,3,1,1248825600,Too Fruity,I had the Passionfruit tea on regular order and loved it.  I thought this might be a nice substitute.  It was not.  I felt as if my taste buds had been bludgeoned by the berry flavor.  If you like very strongly flavored tea then this is for you.  However if you are looking for a delicate flavor to compliment the tea then avoid this tea at all cost.,1.2193337560357022e-05
249,413745,413746,B0026KPDG8,AKU6UCK068L9H,Eleni Fredlund,0,0,3,1318723200,not as good as BBQ flavor,"BBQ was out-of-stock when our subscription order was due, so I tried these. Still light and less fatty, but the flavor is off.",2.3452707615094163e-05
139,222885,222886,B000UUWECC,A1WY0OXO2Y3K4C,SushiLover,0,0,5,1347235200,Love the taste and convinence,I love coconut water and grew up drinking the 'real deal' straight from the coconut. I really like the taste (its close to the real taste) and I love that that I can carry the little containers wherever I am going.,2.2533840194512107e-06
1170,228330,228331,B003VXHGPK,A2BUR03REASIKQ,"Nathan M. Scaparotti ""crankywanker""",0,1,1,1320019200,Hazelnut?!?,Ugh... no where on the Amazon page for this item did it state that it was Hazelnut flavored.  I have been choking this down for a month just trying to get through it.  Thought it was going to be a Blue Mountain-like Jamaican coffee...,1.2193337560357022e-05
1148,432706,432707,B003MWBFXY,A3B2KMJ5J2G7NG,Anderielle,0,1,1,1319587200,Worst Junk Food Ever,"I have two cats and have always been feeding them this food,one is 5 and the other 9 years old and they are both 15 pounds.So they are fat and I could never figure out why,since they only got to share on cup between each other all day.So about two weeks ago I did some research on this food and my eyes were opened.I feel horrible that I fed them this junk food and I thought I was giving them the Best out there,since my Vet gave it to me and said it was great for them.<br />So anyways my male cat is now on Wellness Indoor dry and expensive wet food like Blue Buffalo,Wellness and Merrick.He loves it and I had no problem switching him over and I already notice the difference in his energy level.But my biggest issue is my female cat,she will not touch any other food than her Science junk food.I tried mixing it with the new food,starting at 75% old to 25% new,nothing she wouldn't touch it.So I tried 90% to 10%,still nothing.She cried and wined and didn't eat one morsel in four days and was just laying in one spot all day having even less energy than before.So I called my new Vet and she said now it is getting dangerous because she wouldn't eat at all.I had to give her her old junk food back,because I did not want her to die.I have no idea what to do,she is so addicted to this food and I can't get her of it.She hates wet food with a passion.I am worried about Diabetes if she will get any bigger.So I am really sad that nothing seems to work with her.<br />I made her a junk food addict,it's my fault.I wish I never started her on this food at all.",1.2193337560357022e-05
96,94270,94271,B001EPQ18K,A2BYSR7DV9UR7,mtnqueen,0,0,1,1332460800,not worth the money,"DON'T BUY  <a href=""http://www.amazon.com/gp/product/B001EPQ18K"">Walkers Shortbread Lemon Thins, 4.2-Ounce Boxes (Pack of 4)</a>March 23 2012<br />Walkers lemon thins should never be shipped. They arrived in nothing but broken pieces and where is the lemon taste????? I feel like I threw my money away. Never again.",1.2193337560357022e-05
1236,379945,379946,B000HDCSTG,A3O8KP1OY513F9,SewingGal,2,4,1,1321920000,Tasted Metallic,"I bought this butternut squash to make pies and squash soup for the Holidays. Sadly, out of the case of 12, only 2 cans were useable. The others were dented beyond belief, and the two that I used had ""puree"" as thick as playdough. It did not mix well with the half & half, sugar & spices, although I was using the soup recipe provided on the side of the can, omitting the onion. So, I made 1 pie & 1 batch of soup. Both tasted very metallic and left a bad, twangy aftertaste in your mouth. No one could finish their slice of pie because of the metallic taste. What a waste of money this was. This is a shame, too, because canned squash is so hard to find. Next time, I'll read the reviews before purchasing a food product. I will not buy this product again and I cannot recommend it to others.",1.2193337560357022e-05
1085,315295,315296,B007OVX77G,A2YK7G5JZW3PT8,Reinbkyandidru,0,0,4,1343001600,Overall I can't complain. Arigatou gozaimasu Noriko! :],"Well, my shipment just came in today. It took a few weeks but it finally arrived! I was pleased when I looked inside and saw my Matcha kit kats, but sadly they were melty. ;( I cannot blame this on Noriko,  since it IS the summer. A few hours in the freezer and they will be totally fine! These are absolutely delicious! Such a smooth texture, the right kind of sweet and the classic crunch of the wafer you enjoy from any kit-kat. These have to be my favorite guilty pleasure. I was also surprised that this seller included a couple of samples of her candy. What a nice gesture! I am pleased with my product, and I thank the seller for having these available so that I may enjoy a treat that is hard to come by!<br />'''''E'''''''''''",2.2533840194512107e-06
492,25121,25122,B0081XIA1E,A3JKWPQOQ6RSNK,AD,4,4,1,1320624000,No good,"My dog figured this out in 20 secs and quickly lost interest right after. Just spinnning a little opens up ALL the food compartments. Also, its hard to get at some of the food given how narrow the opening is. Would not recommend.",1.2193337560357022e-05
420,525112,525113,B0046HEMB6,A2NSSGSFTEE2ME,Real,0,0,5,1337904000,Love this Marinara Pasta Sauce,"I didn't expect this to be So Very Good, but it is.  All should try it. Vendor Ships quickly and I was very satisfied with my order.",2.2533840194512107e-06
1338,387048,387049,B004EE2UR4,AUOB0J10F5ULB,Holly,0,0,5,1323561600,tea,"this tea was very good,love it and would buy this product again soon. this is my all time favorite of all teas.",2.2533840194512107e-06
1089,429375,429376,B000EHZZT0,A1GKUJKQKSE29O,Oribs,0,0,5,1326585600,Organ custard powder natural vanilla,"Organ vanilla flavored custard powder is a must have for my son, he enjoys it so much with his crackers that he does not mind having it everyday.",2.2533840194512107e-06
500,240336,240337,B001VJ0B0I,ACVDL5QRCOPE1,D. H.,1,1,3,1348444800,"Not bad, but one dog doesn't like it.","This isn't a bad product, but I have two small dogs, and one dog will eat most of it, but will leave some of it behind. The other dog won't even go near it. Now both my dogs are not only spoiled, but they are also used to only eating Ceasar dog food. So I can't say I would go out and buy more, but at least one of my dog's will eat it.",2.3452707615094163e-05
286,855,856,B0007NG568,A1XDNMQMY5PYFZ,"D. Berghorst ""denab""",0,2,2,1311811200,Funny taste,"I can't eat these oats, they have a funny taste to them.  My kids also think they taste funny.  My husband thinks they are OK, so he has 50 pounds of oats to eat on his own!",1.2193337560357022e-05
1227,125098,125099,B0038B1ET4,A30DX2NMU5BY1L,Tiffany,0,0,1,1345334400,Hard to choke this down,"Yuck. Really, the initial taste isn't bad, but overall I couldn't take more than one sip. I tried mixing it with everything, but the health benefits just aren't worth gagging over.",1.2193337560357022e-05
519,423798,423799,B000G82L5I,A1EZ3PORK6OFQ2,SusanLynnJ,0,0,5,1301702400,The caviar of brown rice,"This rice is suprisingly good, the texture and flavor are perfect. Who would of thought that there was a brown rice out there that is so good that we enjoy eating it everyday?",2.2533840194512107e-06
329,493927,493928,B002QWFT5Q,AB2YZA2HLY75H,Reb,2,2,4,1204416000,mostly good,"Our dog LOVED the edible bone, and the floppier brown rubber bone was a favorite for a long time.  The floppy brown bone survied her puppy teeth with almost no damage.  The white bone is really stiff and hard, almost plastic feeling, and she had no interest in it then and as she has aged, doesn't like it now either.  She ignores it completely, not even bothering to bury it in the backyard, which is her favorite thing to do with all her treats and toys.  Maybe other dogs will like it better.  2 out of 3 bones were great!",2.2533840194512107e-06
163,490483,490484,B000CQE3IC,A6Y8EIDA0F99A,Vi,1,3,3,1297382400,Good by slow,The product taste good and everything is ok. But the shipper really ships too slow. Took 5 Days for them to ship out. And took 3 days to arrive and that is with 2 days prime. WTF?,2.3452707615094163e-05
1464,190393,190394,B000LKVFBM,A138WREYOOTERX,"Hartmut W. Kuntze ""Kuechenmeister""",13,19,2,1180051200,"""pain pour Nicole""?, Napoleons favorite horse","It ain't what I remember, from when I emigrated from good ol Germany in 1976. But it is still better than the caramel colored abomination the bakers over here try to peddle as ""pumpernickel"". Even though it is a far cry from the real westphalian stuff that used to be baked long and slow with the maillard reaction providing the sweetness and caramelization and not some bottle from the laboratory.<br /><br />Nevertheless, the real stuff from a german noble bakery probably fell victim to industrialization, like so many things in this world. Schade.<br /><br />It will still give you a pleasant source of fibre in your bread, but real Pumpernickel it ain't, more like a very heavy KOMISSBROT.<br /><br />Kuechenmeister Kuntze.",1.2193337560357022e-05
1326,560278,560279,B002UT92EY,A215YRPBJJQH8S,M. Griffin,0,0,3,1333065600,This stuff didn't work for our cat,"I have no doubt this product contains quality ingredients, and for many cats it might be a key to good health and nutrition. We were looking for a high-quality grain-free food, and our cat wasn't able to digest this well at all. She seemed to like the taste of it just fine, certainly never ate less of it than other foods, but it gave her diarrhea which persisted even when we cut the food down to a 50/50 mix with her old food. As soon as we switched her to a different food, a more conventional healthy weight loss formula, the problem went away immediately. I don't mean to imply this will happen with every cat, and I can see there are many good reviews here (which is why we tried it, despite the price being quite a bit higher than our usual cat food), but I thought I should mention our cat's strong reaction. If your cat is sometime ""iffy"" with new foods, you might consider purchasing a smaller quantity of this first to make sure they can digest it OK.",2.3452707615094163e-05
66,413848,413849,B0026KPDG8,A1VWY3BJOQZCGC,Love them in Maine,0,0,5,1290124800,Great Chips with less calories,These chips are delicious and good for you.  I buy the small bags and they are just right to eat with your lunch or for a snack.  I would recommend them to anyone who loves chips but doesn't like all the fat and calories.,2.2533840194512107e-06
1430,135832,135833,B0046HJN5G,A3B2MU3VUY079J,dwiz9090,0,1,5,1341360000,FABULOUS!!!,"THESE BARS ARE GREAT. THEY ARE JUST THE RIGHT AMOUNT OF ""SWEET"" TO SATISFY YOUR SWEET TOOTH. THEY ARE LOADED WITH NUTS AND PACK A REAL PUNCH THAT TIDES ME OVER TIL DINNER TIME. HEALTHY SNACK!",2.2533840194512107e-06
24,469448,469449,B001LQNUZ4,A1NEDBJA16RS6A,TomA,3,3,2,1260748800,Below Average,"I bought this and the Sumatra blend (which was even worse) because of the great price. Unfortunately, there is a reason for the price. This seems to be low grade coffee. It is very bitter and bad tasting. The pods don't even smell that great... fresh ground french vanilla coffee usually smells fantastic. Avoid.",1.2193337560357022e-05
1109,372745,372746,B002Y750AC,A1MNQYPJ2BCC05,"Christiana Hancox ""Tegwan""",5,5,1,1289260800,Ughhh!  Be warned - don't buy if you want something natural.,"If I could give this no stars - that is how I would rate it.  Called extract, but is, in fact, artificial.  Misleading information - no indication in the detail that this is an artificial flavoring - be warned.  Only realised when I actually received the item.  Learn by my mistake.",1.2193337560357022e-05
684,438862,438863,B003UEMJ7A,A1QL0H2XRMJ2FK,Cheuk Lau,0,0,1,1330992000,Lacks flavor compared to Tazo chai,"I started my chai tea w/ creamer habit using Tazo chai which has intense flavor.<br /><br />I decided to give Twinning ""ultra spice"" a try and it completely lacks the same ""kick"" as Tazo chai.<br /><br />Very very disappointing.",1.2193337560357022e-05
1196,38845,38846,B000ICO8GW,A16UZNHI3Z142Q,"Darlene M. Roy ""msdarlene""",1,1,5,1261872000,Maybe the best coffee on earth!,"Smoooooooth, mellow and a nice overall coffee. It's my favorite coffee, and this is my drink of choice. I have a machine at home and one at work. At aprox. 50 cents a cup, it beats the Starbucks, Dunkin Donuts, and all the other high end coffee shops by a lot. I drink on average 5 to 8 cups a day and would go broke buying at coffee shops. I love, love, love this stuff!",2.2533840194512107e-06
1125,296043,296044,B000UMK6RU,A182TJNK89IDUG,"stardustsara ""stardust""",4,5,5,1288137600,cushings disease alternative treatment for dogs,i have been using flax hull lignans now for about 4 months at the suggestion of my vet.  i was amazed to see how my dog responded to it.  she had a lame leg which is now working almost perfectly and she does not drink and urinate as often as before.  it is like a miracle to see how active and healthy she is now.  my vet is thrilled.,2.2533840194512107e-06
999,496785,496786,B005HG9ET0,A1BK60GZ4QME6I,John W. Graham,0,0,4,1346284800,convenient source of alkaline water,"This water is based on the premise that many people experience an acid/alkaline imbalance.  In general, the western diet is more acid-producing, and there are issues that arise from a chronically acidic condition.  An approach to being overly acidic is to counter the acidity with alkaline foods.<br /><br />There is one school of thought that says alkaline water can't really change the pH of your cells because your body automatically maintains its own pH balance.  But maintaining a proper pH balance is difficult if you're constantly introducing acidic foods and drinks.<br /><br />Water can be either naturally alkaline or naturally acidic.  Chemically pure water is one oxygen and two hydrogen atoms connected by covalent bonds.  In nature, water dissolves many different substances which give it various tastes, odors and pH values.  Pure water has a pH between 6.81 and 7 depending on the temperature.  Water with a pH less than 7 is said to be acidic and water with a pH greater than 7 is basic or alkaline.<br /><br />A pH of 9.5 puts Essentia water somewhere between baking soda and milk of magnesia.  So this water is not just mildly alkaline - it is quite alkaline.  The taste is really quite pure.  I couldn't detect any off-taste or odors.  The water just tasted clean and pure.<br /><br />In my opinion, drinking a bottle or even a case of this water won't magically restore your body to an ideal pH level.  But it will induce your body to potentially counter an acidic state, particularly if you tend to be overly acidic.<br /><br />If you wanted to make your own alkaline water at home, you could do it by getting a good quality distilled water and mixing in a half teaspoon of baking soda.  This will give you water in the 8.5 to 9.0 range.  But I guess the benefit of drinking Essentia is that it's is purified through micro-filtration, UV lighting and reverse osmosis which rids it of chlorine and fluoride.  They also add minerals back in and restructure the water through ionic separation.  What is ionic separation?  In this case it is a process that creates smaller molecular clusters which support more rapid hydration.  But understand that water molecules don't organize unless there is an impurity in the water (hence my suggestion of making your own with distilled water).<br /><br />My verdict:  If you suspect or know you are overly acidic, Essentia could help make your body more alkaline (provided you are not negating the effects by continuing to consume mostly acidic items).  If convenience is what you're after, this water is going to be consistent and it will have a great taste.",2.2533840194512107e-06
203,26653,26654,B000YSS7EO,A1T0VNO8O4AWMR,Greenutahmama,1,1,4,1310688000,We love HappyBellies!,"I tried to use the cheaper cereals with my baby and she would refuse them.  From the moment she tried the HappyBellies, feeding became so much easier.  She loves the way it tastes.  My only complaint is that I wish it came in bigger packaging.  I feel like I am always opening a new can and would rather there be less packaging.  But at the same time the cans are very easy to transport when traveling.",2.2533840194512107e-06
573,376605,376606,B00015UC7K,AZARTTC0YBP77,Jeremy Genovese,0,1,1,1350950400,product not vegan,"when I received this product I discovered that it contains calcium sterate, which is made from animals. This should have been made clear before I ordered the product.",1.2193337560357022e-05
481,155194,155195,B000GAT6NG,A1QV4VPFKPDGBF,"A. M. Wedemeyer ""Mel""",1,1,5,1251244800,I can't get any better than this...,I used to pay $15 or more at Lassen's  for a 14 ounce jar of this same brand of coconut oil. I can't believe I pay only $21 for 54 ounces of it. I use this oil not only for cooking everyday but also I rub it in my skin and I  use it in my hair..I even get compliments in the way my skin looks or the way I smell too..It's totally amazing! Don't forget the health benefits of it too..It doesn't hurt to  burn some extra fat..I highly recommend this product! I love this coconut oil!!!:),2.2533840194512107e-06
618,122724,122725,B000FDMLVS,A3UCN2RGY7O6S1,"Joanne ""Gotta Eat, Gotta Cook""",8,8,5,1273968000,Great value!,"I am using the HEALTHY BREAD IN 5 MINUTES A DAY cookbook and all recipes use vital wheat gluten. One box of this in the supermarket is double the price of one of these; so eight boxes for $10 and change is the only way to go. The expiration date on all boxes is 1 1/2 years (from today's date), so it will last a long time.  I called Hodgson Mills and they said to prolong the life even longer, it can be frozen. If you bake bread using whole grain flours, this is definitely a great savings!",2.2533840194512107e-06
509,152025,152026,B00141R0IO,AMFVD9RAWR4RA,"L. Fisher ""Amazon dot calm""",2,3,1,1316131200,Unhappy hips! supplied by AMAZON,"<a href=""http://www.amazon.com/gp/product/B00141OWXU"">Dogswell Veggie Life Vitality Sweet Potato Chew Treats for All Dogs, 5-Ounce Pouches (Pack of 6)</a>A year ago these treats were perfect and my pooch loved them, ""just what the doctor ordered"". HOWEVER, the recent shipments have been of inferior quality, poor quality. The product is dried-up and as far as my dog is concerned, unacceptable. She refuses to eat the treats and walks away from them. While the expiration date is in 2012 the product has to be tossed, it is anything but fresh.<br /><br />What illuminates this even more is that the local pet store is now stocking these treats. At the pet store, the products look and are soft and well managed and loved by the pooch. Clearly the treats from the AMAZON vendor is without quality and may have been rejects.<br /><br />While the cost in the pet store is much higher, it is well worth it.  Proves that you get what you pay for. If  it is 'Happy Hips' that your dog likes go the pet store or perhaps AMAZON will find a quality supplier.",1.2193337560357022e-05
453,17973,17974,B008ZRKZSM,A339AB8YDYJ5MO,DL,1,1,5,1317686400,pb2powder,My daughter loves this peanut butter.  It is low in fat and although it isn't exactly like peanut butter it is a great substitute.,2.2533840194512107e-06
301,207189,207190,B003D4IYSU,A244ZOEIN2H8A7,David Calder,0,0,4,1349568000,Pleasant,"This is a pleasant tea that is perfect for a relaxing cup during the day.  Some Earl greys come on strong, but this is mellow and just what I was looking for.",2.2533840194512107e-06
1458,59755,59756,B0028W3P9G,A1ZUYL6KKQTBIK,SarahB,6,6,2,1284681600,"stale, disappointing","I was so happy to see Israeli Couscous available here, but when I got it, it was stale.  I tried to cook some anyway to see if it was just a strong wheat smell throwing me off.  Nope, it really was stale--disappointing.  Because it's whole wheat, it can go bad quicker than other similar products.  I hope this is offered again when they find a way to refirgerate/freeze it before it ships so that it doesn't get stale.  Also, the manufacturer probably needs to add an expiration date to the packaging so that warehouses know when to get rid of it.",1.2193337560357022e-05
173,444917,444918,B000812K0O,A16VJLRW9CPD30,Rica,0,0,4,1300924800,Crunchy and Sweet,"I am following a low carb way of eating and was looking for a protein bar that didn't remind me of a tootsie roll.  This is nice and crunchy, but a little too sweet for my taste.  So instead of eating it by itself, I add it to my morning breakfast of greek yogurt, nuts, and coconut oil/flax seed oil.  Now the sweetness is offset by the tartness of the yogurt, and perfectly balanced out.",2.2533840194512107e-06
322,323597,323598,B0017I1QE8,A2T61NNBDATBWY,lazycook,0,0,3,1318291200,to sweet for my tastes,"It is up to every one taste buds which are so different, but for me just to sweet.  I did eat them so I'm not complaining.  My one negative comment would be some slices were crunchy (good) and some were not (no so good).",2.3452707615094163e-05
727,184261,184262,B005OPQJSS,A1Z4LX3Q1YMF84,"Cindy A. Osterhout ""Cindy O""",0,0,2,1348617600,Five of Five Cats Will Not Eat,"Dear readers: Our Mom hates to write up a negative review, so we are taking all the responsibility for this negative bit of writing. ""We MADE her do it!""<br />This is the third Fancy Feast Appetizer our Mom has had shipped to her for us from Amazon. We really like the other two vaieties, but we DO NOT like this one. It has a Yucky taste and we are horrid and will not eat even the broth. We stick our little noses up in the air and walk off because we are certain that something better will show up if we do so. (Usually we are just scolded for our attitude and we get no extra food, but we persist in REFUSING to eat even the tinniest bit of this!!!!!) We do like the Talapia:<a href=""http://www.amazon.com/gp/product/B005EJGVVY"">Fancy Feast Steamed Tilapia Appetizer in a Delicate Broth</a> and we do like the White Meat of Chicken.<a href=""http://www.amazon.com/gp/product/B005OPQKN2"">Fancy Feast Appetizers for Cats, White Meat Chicken, 2-Ounce Tubs (Pack of 10)</a>. But we say ""No Thank you to this."" We think it is the flaked Tuna that we do not care for.<br />Again, DO let us point out, that this is our decision and not the decision of our Mom. Even the guy that lives out back that she feeds, the one she calls ""Feral Kitty"" will not eat this. So We are only giving two stars. We are sorry to be so Negative, but we are finniky and WILL NOT eat things that do not taste good. So that is our vote: Gabriella (4years), Trinity (3 years), Wisdom (1 year), Mercy (1 year) and ""Feral Kitty"" AKA Yellow Kitty (10 years.) Thank you. We are finniky, but also quite polite!",1.2193337560357022e-05
540,275953,275954,B000VGCSLC,A79E6B9F97KLF,Sylvan O. Rue,0,0,5,1341014400,Strawberry Bon-Bon's,product arrived on time in perfect condition exactly as described. These are the best hard candies we have ordered. Cannot find them anywhere in the retail world.,2.2533840194512107e-06
559,413981,413982,B0026KPDG8,A2MQ558CSD9N8B,Cloudcroft Girl,1,1,5,1347753600,Excellent Snack,Popchips are a perfect late afternoon snack.  Gives me the energy I need for a few more hours.  I have it set up for periodic automatic shipments.,2.2533840194512107e-06
115,320247,320248,B003Z6W32E,A3P84TZX9X1B3X,"KIMBUYS ""kimbuys""",0,0,5,1296950400,Best instant coffee out there,"If you have to drink instant - this is it.  I buy these through amazon and at my local grocer and take with me when I travel, as I hate the cofee in the hotel rooms.  Just use the hotel room coffee maker to make the hot water.  Hope these come back in stick soon.",2.2533840194512107e-06
655,206387,206388,B0000GH6XI,A2C6O8K3PY6QR5,Mr. Baker,0,0,5,1285718400,Excellent!,"My espousa recommended these to me. My Grandchildren beg for them. Very tasty, very authentic. A little pricey'er than in the stores, if you can find them! Our local grocer stopped carrying them. Still a good value for one or two servings each, depending on your consumption levels. My kids eat until it's gone!<br />Sometimes you gotta pay to eat right.",2.2533840194512107e-06
1293,243349,243350,B00305L330,ATLSUFV0XPYC8,Amy Graves,0,0,5,1273881600,I get my daily protein in now!!!,"I love this Vanilla click! The mocha is a little too strong for my taste, but this one is great! I've struggled for 9 months post-op RNY to get my protein in and now I have no problems. I've been doing this daily (usually twice a day!) for almost a month and a half now and haven't gotten tired of it at all!",2.2533840194512107e-06
