,num,Id,ProductId,UserId,ProfileName,HelpfulnessNumerator,HelpfulnessDenominator,Score,Time,Summary,Text,weight
945,29507,29508,B000PDY3P0,AP1N9Y6K40YNW,Julie,2,2,3,1342915200,"Captures that movie theater taste, but far from perfect","I purchased this product for use with my new Maxi-Matic popcorn machine, with the goal of producing that movie-theater taste that none of my previous popping efforts had replicated. These portion packs succeed in that the flavor is spot-on. They might even be better than what you'd get in a theater because the flavor is so fresh when just popped.<br /><br />Unfortunately, the flavor alone doesn't make this a great purchase. As others have mentioned, the texture of the popped corn varies widely. Of four pre-portioned packages that we've popped so far, three produced stale, chewy popcorn. When we tried the fourth batch using the packaged butter salt and coconut oil with an equivalent amount of another brand's popcorn that we had on hand, it was much more tender.<br /><br />Also, if the packs are poured directly into the kettle as intended, the resulting popcorn is almost inedibly salty. Much more palatable results were produced using about half of the packaged amount. But by the time you're customizing the pour, the 'convenience' factor of these packages is shot. Not that they're very convenient, anyway - the 4 oz. portion was very difficult to transfer into our 4 oz. kettle. The bag is very big compared to the working space inside the heated kettle elements, and it's almost impossible to make popcorn without oil, salt, and kernels falling all over the place or dripping all over the bag.<br /><br />Considering the portion issues and difficulty of use, in the future I'll be buying the three components separately. I'd stick with this company's coconut oil and butter salt, but would likely get different corn.",2.3452707615094163e-05
1316,233494,233495,B004WJATHO,A24OX6XLW4L331,OKCJohn,0,0,3,1342224000,You will love it or hate it...no in between,"I ordered it but didn't realize that it was flavored coffee.  I can drink just about any coffee flavored or not.  The description says lightly flavored which I think is a little off.  There is a distinct coconut flavor to the coffee.  If you like coconut, you will love this coffee.  If you like no flavor or coffee with a hint of flavor, pass this one up.",2.3452707615094163e-05
1228,512237,512238,B0029K3EJS,AKNCY5WCXLQ4H,"Sheryl L. Kok ""Blondie""",15,15,3,1255737600,Ok but most cans dented,"Obviously this company is off-loading its dented cans via internet shoppers.  Out of twelve cans I received, only one was in pristine condition.  Three of them were severely dented to the point that I would never have bought them if I had been at my local grocery store. I don't think the seals have been compromised but it is borderline.  The other eight cans all have small dents and scuffs as if they had been dropped at some point- cosmetic damage only.  I am happy to have the product as my local grocery stores are having trouble getting canned pumpkin and I am craving some pumpkin pie, but I think Osbo should disclose the fact that it is selling dinged cans and not send the really bad ones at all.  I will avoid this company in the future because of this lack of disclosure.",2.3452707615094163e-05
124,256578,256579,B003JA5KBW,A7JGEKN140F4S,"Keith ""kc31824""",0,0,3,1323907200,Take a vitamin instead,"Doesn't taste very good, and I'm not sure the health benefits are that useful relative to taking a vitamin.  Get a jar of Pom juice from the market and use that to wash down a multivitamin instead...",2.3452707615094163e-05
1455,8540,8541,B003VXFK44,A2VBTN6ZR67YOF,Mike Jacobs,0,0,3,1306972800,A little too much bitterness & acid,"This is less of a ""bold"" flavor and more of an acidic and bitter coffee. My wife is easy to please and she's not a fan. I'll finish the box but I reach of others first.",2.3452707615094163e-05
858,152216,152217,B004OVATO8,A3VC7USARJ95WK,Gwen,0,1,3,1340150400,Not bad,"So far the one box I opened didn't make me sick or anything, so I'm assuming the other three boxes I ordered will be around the same quality. It's a little salty for my taste, but the bars have good ingredients and seem to be of high quality. I'd recommend trying.",2.3452707615094163e-05
653,208169,208170,B005HGAV7O,A28SX2HB35APYX,Richard,2,2,3,1325116800,I like tea.,"Got the my order, opened the box, and the first thing I notice is there is no package for the cups. Fine by me. Look through the box, didn't get nearly close to the advertised cups. Has all the flavors, just not the right amounts. I only got one of the oranges and it wasn't Celestial Seasonings, got about 8 of both Sleepytime and Lemon Zinger, and 7 of the Cozy Chamomile and Mint Melody and finally a few random ones like a Gloria Jean's Peppermint. All the tea and cups were fine I just didn't get the right amounts. Can't complain though, I like tea.",2.3452707615094163e-05
1303,385157,385158,B005VOOM5E,A16WPA6JV83YXT,"Sandra Trolinger ""trolsgirl""",0,1,3,1334448000,Pleasant but nothing to get excited about,"I love coffee and I start my day with it and I drink half a pot in the evenings too.  So I was excited to try this blend but it was not as exciting as the description on their website. The scent was fragrant and inviting but the taste fell flat. After drinking 3 cups I think it is a bit bitter and it has an aftertaste with no hint of the ""floral notes and reveals hints of blueberry, cocoa and spice. This well-rounded coffee features a bright acidity. One Love tantalizes your palate, and leaves a profound cherry finish"" as described by their enthusiastic marketing department.  Try Komodo Dragon by Starbucks instead. Bob Marley needs to stick with his day job.",2.3452707615094163e-05
104,446219,446220,B00653S7II,A25JYR0CYSD0U7,heathermartin1,1,3,1,1324857600,WAYY overpriced,this price is a joke right? the cherries and blueberries both are one dollar at walmart. But unfortunately my walmart only has the cherries(which are delicious). But I wanted to try their blueberries. but not for ths price. I'll just wait until the holiday season next year i guess.,1.2193337560357022e-05
757,254004,254005,B000IZ3GXA,A1NBTOK1P2O3YV,aihebb,0,0,1,1323561600,Disappointed,"I'd like to try something different and chose this one. I was so disappointed, tasted plain, cannot be compared with <a href=""http://www.amazon.com/gp/product/B001EQ56T4"">Ferrara Instant Espresso Coffee, 2-Ounce Glass Jars (Pack of 6)</a>.I used the latter in Baking and it worked perfectly. I don't even want to try this in my cake recipe!<br /><br />The worse thing is I cannot return this item and don't know what should I do with the rest. It may be my personal taste, but it is better to just buy one jar at the first time to see whether you like it or not.",1.2193337560357022e-05
117,202606,202607,B001EO5TJ8,A3C39I4ZCC5212,Anthony Quang Pham,0,2,3,1310169600,Very strong...,"This is my first bag of chai tea and I have to say, it's extremely strong if you try to drink this straight. I can barely taste the tea itself, just a bit of bitter, and an extremely strong spice taste.<br /><br />It gets better if you water it down a lot, or take it with a lot of milk (basically a chai tea latte), which I suppose is how it's supposed to be drunk. But you start losing the base tea and only get the other spices.",2.3452707615094163e-05
309,13016,13017,B000EVT04C,APRCWWXN9S5KE,J. Matthews,0,2,3,1319155200,"Very berry, but very greasy","Okay, I admit it, I'm a red licorice junkie. But I don't care for Red Vines or Twizzlers; they just don't have the ""tooth"" I desire in a good whip. These spirals are very tasty (almost too good) and they offer a good, long chew. The one drawback is that they tend to be very oily thus the reason for my 3-star rating. Still the berry flavor is spot on. Just what I love about strawberry licorice. Warning: Having a 5 pound bag of licorice in the house will weaken even the mightiest willpower. You've had your caution.",2.3452707615094163e-05
206,465644,465645,B001H32FMK,A1T5QLXIT6R250,"SORJOURNEY TRUTH ""Journee""",0,0,3,1284768000,seafood,"Shipment arrived as scheduled. Fish was partially thawed, yet it was packed with these cold packs that kept the fish cold. It was not smelly, tasted was good, could have been a larger packge however.",2.3452707615094163e-05
1284,346899,346900,B000RE96FY,A3HXT4P8NFA3KC,"Robert ""Okc spike""",0,0,3,1344384000,"Drinkable, not great","This coffee is ok, but nothing great, at least in my opinion..  I will not throw it away, but neither will I order any more.  It has that sharp aftertaste that I don't care for.  It isn't as strong as I expected it to be, which could be one reason for my disappointment.  If you like mild coffee and just drink coffee for effect this is a decent and well priced product.  I enjoy coffee and drink it for taste as much as effect.  The packets are easy to open, which I appreciate.",2.3452707615094163e-05
1095,62750,62751,B000I1OLT2,A3OPH5QDQRBNPT,Marilyn49,3,11,1,1250985600,Gluten in Tea!!!,I bought one of the Stash teas-don't remember which one. It contained gluten!  I am gluten intolerant but NEVER expected ANY tea to contain gluten.  There is NO reason for tea to contain gluten.  Celiacs beware!,1.2193337560357022e-05
1226,453572,453573,B001E5E0V0,AKUY4XIK5HRA8,"Carolina boy ""Rob""",0,3,2,1241568000,Buyer beware - (1) whole bean and (2) ground is what I found!,"The rating is driven by the purchase of whole bean and receipt of ground.<br /><br />Excitedly waiting for a Blue Mountain blend, we received the coffee package.  Oddly enough, the first cannister was indeed whole bean and very enjoyable.<br /><br />However, the second cannister was ground; and yes, the third was ground as well.  I opened the other after the first.  After having a few cups of the ground, we ended up buying more Dunkin whole bean.  The ground left much to be desired with taste and freshness.  It is, however, better than some store brands.<br /><br />We are still using the first of the ground cannister as a spare and feel bamboozled.",1.2193337560357022e-05
16,6949,6950,B001LG945O,A39G26LKBXB83D,RFB,0,0,3,1246924800,"Not bad, not great","It's not bad. Good ingredients for a change so that's a plus. Taste is okay but not great. I would drink it if offered, but doubt I'd buy it.",2.3452707615094163e-05
692,456163,456164,B003BJZMSM,A1IQYPFSBMX3LS,"Florence R. Wohl ""Grammy Flo""",1,2,3,1310947200,Guilt-Free but not that great,"I loved the idea of this snack. As others mentioned, enough crunch and volume that it is hard to finish a bag. The flavors are not that great. I really like Honey Mustard and Onion flavored snacks but the smart fries, not so much. My six yr old loves snacks but not even the cheddar was appealing to her.",2.3452707615094163e-05
611,562570,562571,B000CRKOIE,A2C8045GSHISYK,W. Baker,2,2,5,1176163200,Bear Naked Granola,"Bear Naked Granola, especially the Fruit & Nut, is a superior product, and we have used the product for some time.  Bear Naked items tend to be expensive in local supermarkets, and the prices are a little better at stores such as Costco.  Costco tends to be out of stock or does not hav the flavor we want.  Purchasing through Amazon was cheaper then the supermarket, cheaper then Costco, and the shipping was prompt and free.",2.2533840194512107e-06
1393,402242,402243,B00099XODM,AKK49Y5DWSEND,ZombieLuv,3,6,3,1203897600,Tastes good but...,These taste very good and are quick and easy.  The only disappointment is the fact that there is trans fat in them.  I figured in this day and age that would be pretty much a no go but I guess Betty Crocker hasn't gotten a clue yet.,2.3452707615094163e-05
1418,343645,343646,B006BXUY2Y,ARYSDAZNRXN6G,A. Crafton,0,0,1,1335484800,Plastic chocolate and sugar..,"These look a lot like a sweet treat when you first open them, I expected a bit of a rewarding experience to eat one. They smell really good when you open them! They have a rich, oaty, chocolate vibe.<br /><br />My first bite was almost the last. It left a stinging, burning sensation in my mouth as soon as I started to chew; the chocolate was like bitter stinging plastic across my palate. The bar was sticky, chewy, and had an unpleasant feel in my mouth.<br /><br />Of course when I saw that the ingredients are sugar, dextrose, corn syrup, glycerin...sugar sugar and sugar. One bar (they are small!) has 7 grams of sugar. ""Soluble corn fiber"" as first ingredient? It has a lot of soy in it as well, more than I expected to see in a granola bar. It's like a bunch of gunk bound together with sugar.<br /><br />For a net carb count of 13 grams (over half that sugar), there isn't enough nutritional redemption in them for me to even consider packing them as a snack. A mere 4 grams of fiber for such a tiny bar, and it probably comes mostly from the corn? The Fiber One bars I've had, taste better for sure. I've never had a stinging and prickling sensation in my mouth from eating a GRANOLA BAR...it was disconcerting. For what it's worth, my husband liked them. But there isn't much he DOES NOT like.",1.2193337560357022e-05
801,48014,48015,B004SRH2B6,A1RYLIR0OD5JBV,"redtulip ""from California""",0,0,1,1318896000,awful after taste,I have eight of these bottles sitting in my cupbard and unfortunately I cannot get myself to drink them. Awful after taste in the plastic bottle. Will not buy this product again. The boxed version tastes much better.,1.2193337560357022e-05
399,23108,23109,B004ZIER34,A1HRYC60VTMYC0,Ace,2,2,3,1312761600,"Smooth, but with a bitter after-taste","Since I love French Roast, I was happy to get a sample of this particular roast. I opened the sealed bag and smelled the contents, which were not as robust-smelling as the French Roast I have been used to. I brewed a cup, and tasted it:<br /><br />1) Black no sugar -- rubbery after-taste<br />2) Black, with sugar -- mitigated the rubbery after-taste which was still there<br />3) Cream and sugar -- removed the rubbery after-taste, was pleasant and smooth but not as rich and aromatic as the French Roast I am used to.<br /><br />After four cups (not in the same day) my stomach WAS happier than when on ""normal"" coffee - I determined that the rubbery after-taste was there to stay. However, the coffee WAS smooth and definitely not acidic. But, it's a sad trade-off: low acid, rubbery taste (unless you mask it with cream/soy and sugar/honey). Hopefully something can be done to ""tweak"" those ""settings"".",2.3452707615094163e-05
93,191281,191282,B001SIY5NQ,A1RDAFCAM562FR,Rod Auric,1,1,3,1320796800,As expected,"This was an impulse buy. I purchased other food items and decided to try getting this from Amazon. I later found that the same product was much cheaper at my local Big Box Membership Warehouse store. The jerky was about the same freshness as I find in local stores. I was hoping for fresher, ie softer jerky.",2.3452707615094163e-05
433,438852,438853,B005HGAV8I,A3EUUL5K04K9Y,Howitska,1,1,3,1328140800,Not Much Variety,"Expected some brand variety and paid more than we usually do to get it, arrived with 90% Green Mountain (the brand we wanted a break from), 10% Gloria Jean, lots of repeat flavors. Not impressed compared to what we expected based on site info.",2.3452707615094163e-05
515,214014,214015,B0000D94PA,A90CO572BWE62,College Kid,3,4,1,1267574400,Truly Awful,"Wow.<br />This gingerbread is terrible. Truly terrible. Inedible, even. It's not just because it is sugar-free. Of course sugar-free cake is going to be a little different and less rich. But this is way, way worse than other sugar-free baked goods. I have had sugar-free chocolate cake and loved it. THIS mix is terrible. There are many reasons:<br /><br />- The batter is like a mousse, that just gets hard when it bakes. So it looks like crap because it doesn't smooth out as it bakes. Every spoon-mark is still there when you pull it out of the oven. It looks really weird. You could not serve it to company.<br />- The cooking time on the box (for the loaf pan) is ten minutes too long.<br />- There is no ginger taste, or cinnamon, nutmeg, or spice flavour in this ""ginger"" bread. It is flat and tasteless.<br />- The lack of other flavours allows the nasty aftertaste from the Sweet & Low(tm) to bloom with full force.<br />- The gingerbread is lacking in body, because it is as light and fluffy as a mousse. It is not helpful for dieters because it is not satisfying to eat because when you eat it, you feel like you haven't eaten anything. Strangely, this gingerbread mousse is also rubbery. Rubbery stiff mousse that dissolves in your mouth.<br /><br />The overall experience is like biting into a vaguely sweet sponge. Then it dissolves. And then the bitter chemical aftertaste kicks in.<br /><br />I have NO IDEA how a slice of this gingerbread could be 160 calories. There's nothing in it, it tastes nasty, and it is gross to chew on! You can have a gingerbread Pop Tart(tm) for 200 calories, or a bakery gingerbread cookie for 120 calories, and they are full of fat and sugar. How can this sugar-free, taste-free, light and fluffy rubber crap be 160 calories?",1.2193337560357022e-05
631,339442,339443,B005A1LJ04,A1WBEIH7Z37LN9,"MagicSkip ""magicskip""",0,0,3,1326672000,"""aka Crystal Light Limeaid""","I know marketers try to make magic by using the latest buzzwords, like ""Mocktails"".  I know there are people who will think ""oooh, Margarita mix, all I have to do is add tequila"".  This is NOT the product for that.<br /><br />If you've had other Crystal Light fruity flavor drinks, this is really just like a limeaid flavor of them.  To call it ""Mocktails Margarita"" is pure sophistry.<br /><br />In any case, the product itself is fine - it just isn't so much what they are trying to say it is.  Calling it ""Mocktails Margarita"" sets up a different expectation from what it really is.  If you like the other Crystal Light fruity flavors, and you like a limeaid flavor, you'll probably like this.  If you're really looking for a Margarita flavor, or for a mixer, you'll probably be disappointed.",2.3452707615094163e-05
601,292770,292771,B005A1L2XI,A2BF1IDDK1BIG0,Waterhog,0,0,2,1349913600,Delicious cookies!,The cookies were delicious but the arrived in crumbs.  I don't know if it was the original packaging from the company or Amazons packing but there wasn't a single whole cookie in any of the 3 packages.,1.2193337560357022e-05
13,490458,490459,B000CQE3IC,A1YELVG03O68F8,F. Bican,0,0,5,1197331200,Great bargain,"Same SlimJim taste I remembered, and I like the little ones because you can stick a handful in a pocket.  Amazon seems to have gotten their act together -- I ordered these and got them two days later.  And as far as whichever reviewer said these are made from cow hair, well, they've got a serious screw loose.",2.2533840194512107e-06
478,480961,480962,B002XUX0FC,A3TP31S61PPE3G,AlexJouJou,3,3,1,1294358400,In addition to price these taste terrible!,I'm a fan of other baked chip products (such as Doritos and Lays Potato Chips) so I picked these up. They taste terrible! They are bland without much flavor but what there is sort of reminds me of sawdust. I'm sure they might be healthier as they are a Baked product but I'd rather eat less of the real thing. I threw them away. Yuck!,1.2193337560357022e-05
1138,492333,492334,B0000GHNWC,A2DVFHG099GUGE,sauerkraut,0,0,3,1341532800,A satisfying hot sauce,"For quite some time, I have been using different types of hot sauce on different types of food.  Before I started doing this, I only ever remember using hot sauce on barbeque sandwiches.  Even though I have tried numerous types of hot sauce during this period, Valentina Salsa Picante Mexican Hot Sauce Extra Hot has set itself apart from the others.  It has a satisfying flavor and is neither too hot nor too mild.  This is a product that I can recommend.",2.3452707615094163e-05
94,388160,388161,B000633Y40,A3PSE7JQ47SKEB,"C. Hansen ""&#34;kegger&#34;""",2,3,3,1309910400,Good product but dog lost interest,"After my dog could no longer get to the remaining filling in the center of the bone, he seemed to lose interest. However, the first few days he had it he wouldn't leave it alone. He still picks it up every once in a while but doesn't chew it very long.",2.3452707615094163e-05
1454,531716,531717,B005K4Q34S,A1NDDKN0RUMTQ,pmonnia,0,0,3,1343865600,Very sweet,"This is the first time I ordered, I hadn't read the reviews, which I know I should have. The product was very very sweet, and I like sweet. I kept the coffee, BUT, personally this might be ok if I make it as an iced coffee for the summer.  I guess if you like extra sweet, this is the coffee for you.",2.3452707615094163e-05
894,346107,346108,B004TJF3BE,A2D11X0Z1N5R93,"Theresa Davis ""Belgian to the Bone""",1,1,1,1322352000,Such a disappointment,"I bought this because a coffee shop in the area has a delicious carmel apple cider, and I mistakenly thought this was going to be as good.  It's not.  The flavor is not natural.",1.2193337560357022e-05
537,60687,60688,B003QNJYXM,A2EACHU71ZO56Y,ES,0,2,1,1320710400,Tastes horrible not worth it,"I got the energy boost of drinking a cup of coffee, however had to hold my nose while drinking it it was so bad. Sticking to coffee which isn't great but is much cheaper and doesn't have all these chemical additives.",1.2193337560357022e-05
521,290051,290052,B005IG5ODE,A2FTGWMYLP4M8U,"BR ""BR""",2,4,1,1328054400,"um, this is ONE over-priced small jar",Hmm  the picture shows three jars as if this is a three-pack. So this ends up being just one very over-priced jar of peanut butter.,1.2193337560357022e-05
256,466838,466839,B0015MY6PC,A1YELX1XVW5A9U,"vdavisoh ""Bargain Outlet""",0,0,5,1219795200,Very Good Product,"Based upon the reviews, I decided to try these as a healthy adult snack.  I was expecting a larger package size, but was pleasantly pleased with the quality and taste.  Perfect, just what I was looking for. I have signed up for the automatic shipping option on these to get them at a lower price also.",2.2533840194512107e-06
1151,140527,140528,B0007R78O2,A312HKLV02UHE1,DJ,0,0,1,1349136000,DESCRIPTION IS INCORRECT,"""The Blue Moon Ice Cream Sampler features one of our best selling ice cream flavors. Blue Moon ice cream has a fruity flavor and is colored blue. You will receive 8 pints of the Blue Moon flavor.""<br />If you get 8 pints of the same flavor, it's not a ""sampler"" or an ""assortment"", and who in their right mind would pay $103.85 (including shipping) for 8 pints of ice cream?  That's $12.98 a pint!.",1.2193337560357022e-05
1172,234794,234795,B000KV7ZGQ,A186GTIBSBFNA8,"Victoria S. Reynolds ""w0Lf SmiLe""",0,0,3,1279584000,not for a rope chewer,within five minutes my 11 month old 60 lb collie/saint Bernard mix had chewed the rope in half.  I used suggestion given by another reviewer and put a racket ball in the bottle.,2.3452707615094163e-05
752,268391,268392,B0001BV4X0,A1ZADRWBUBXAS7,John Hollingsworth,0,1,1,1310256000,Worst order processing ever,I ordered Boylan's Birch Beer June 7th sent an email after 2 week to them through Amazon never received a reply. Amazon should auto delete this order because of no action by Boylan's for 30 days.<br />The really sad part of this story is that they make really super great Birch Beer soda.<br />I have since been able to find Boylan's in a local store here in Florida.,1.2193337560357022e-05
660,270607,270608,B000FI2VHM,A13SVBJSSHPU5H,Pattie,2,2,1,1229644800,Do NOT buy Salad Greens Seed Kit,"Despite what the package claims, namely that the seed kit contains a mix of Red Leaf, Green Leaf, Butterhead & Romaine, it, in fact, had seven pots of the same seeds, namely Butterhead lettuce.  Had I known this was the case I'd not have bought it, and feel deceived by the packaging.",1.2193337560357022e-05
435,498487,498488,B001ELL76U,A3PFI1B6M35CIN,R. Perloff,3,4,3,1284249600,Vanilla flavor,"Mild vanilla flavor but nothing special.  As I make my own ice cream, I'm very fussy about my flavorings.  They need to be more intense than this one to get the flavor I want.",2.3452707615094163e-05
1443,111480,111481,B000BN82I8,A1ZGS3Q1S15YUU,G. Carter,1,1,2,1248134400,Counterfeit? Or lousy quality control?,"I also have had inconsistent results with this product. In addition, the labels on the cans aren't always the same--one indeed looks completely fraudulent. Another is dimmer and the contents were a slick, pasty substance that looked cheap and SIGNIFICANTLY different from cans that have more legitimate looking labels (they look brighter, crisper as if done on a proper printer, not some fly-by-night).<br /><br />So either they get their stuff from different suppliers with haphazard quality control in some cases or, as with SO many other products from drugs to DVDs, someone is canning some [...]crap and passing it off as Natural Balance. In any event, I'm disappointed, disgusted and dissatisfied with the company's response and apparent indifference to the issue.",1.2193337560357022e-05
283,551845,551846,B0000GHNVS,A2VMGLANJ79CR6,ZachMorris,0,0,5,1326672000,Great Sauce,Had to get my favorite hot sauce before moving abroad. It came very quick and I'm very happy with the product. Huge bottle.,2.2533840194512107e-06
421,141764,141765,B003GTR8IO,A2CT2SA6KFE8GC,"Stanley Runk ""Runkdapunk""",1,1,2,1294099200,Nah.,"You know, I have to say I wasn't impressed much by this stuff.  I'd like to say otherwise, but I'd might as well be honest.  Taste wise it was so-so, but the real zinger was a nasty aftertaste.  I'm not crazy, my wife experienced this too.  Sure, individual coffee makers can alter taste, but since everything else is fine going through ours, my money's on the coffee itself.  Sorry.",1.2193337560357022e-05
