,num,Id,ProductId,UserId,ProfileName,HelpfulnessNumerator,HelpfulnessDenominator,Score,Time,Summary,Text,weight
1234,542690,542691,B000EDBPP2,A1ODZ7SDUPEGNK,"Kurt Harding ""bon vivant""",14,15,3,1166572800,Good Eating If You Are A Bird,"When amazon debuted its grocery store, product choice was quite limited and so in order to take advantage of the discount offered if one bought a certain dollar amount of goods, I included this in my cart.<br /><br />My breakfasts tend to be cereal because the meal is quickly prepared and there is no mess. I like cereals with a lot of fiber, but I also like honey and almonds so I chose Bob's Red Mill Granola, Honey Almond. Well, this is great eating if you are a bird but unless my taste buds have been destroyed by decades of eating spicy food, I detect little of the flavor of either honey or almonds. I am not implying this tastes bad, it does not, but its sorely in need of something to jazz it up. My choice for that has been fresh berries.<br /><br />Blandness aside, I do think I got value for my money as the price is hard to beat and I will get many mornings worth of nutritious meals from it. So if you don't mind your cereal a little on the bland side, this isn't a bad choice. But next time, I'm going to look for a product with more flavor.",2.3452707615094163e-05
99,154743,154744,B0014WYXTC,A1HOLJW15Q5S5V,"James John Hollandsworth, M.D. ""lightalongthe...",4,4,3,1210464000,A Healthier Choice than Regular Soda,"I was a little skeptical at first when I got these for my kids, but I came away impressed.  They loved the taste of the grapefruit, apple, & pomegranate flavors, and I felt good that with fruit juice and added vitamins Izze is healthier than regular soda.  Downsides: they are still concentrated simple carbs, there are some health concerns regarding the health effects of carbonated beverages, and the premium price.",2.3452707615094163e-05
383,290049,290050,B004303CYO,AWIBPIXDCV4E6,$4$ &#34;Rick&#34;,0,2,1,1312329600,EXPIRED Product,"I love this product. I use steamed milk instead of water, and it is just like the $5 venti mocha at the store.  I have been buying 4-6 boxes per month, for the last 10 months and **each** box had the same expiration date of 8/11/2011....for 10 straight months!!  I was especially interested on this last order to see if they were going to send boxes expiring in 2 weeks. They did not. They expired LAST month.<br /><br />The one star is for the horrific service (no longer shipped & sold by Amazon).<br /><br />Come on Starbucks, you can do better than this!!",1.2193337560357022e-05
1144,314619,314620,B000V1JVC6,A1ZDKD94PS13M7,Ronald Ensley,7,11,1,1268438400,Not so good,"I purchased these products as an emergency backup for non-parishable foods but they taste so bad, I would need to be starving before I could eat them.",1.2193337560357022e-05
1364,296154,296155,B000EQT77M,A2MNB77YGJ3CN0,L. Mountford,0,0,4,1349395200,Decent flavor ...,"I tried the ""Sea Salt"" variety crinkle-cut chips and they were pretty good. A little thicker than I'd anticipated, so harder to eat. But the flavor was good, with just the right amount of salt. Not sure I'll purchase this variety again, but I might try one of the others.",2.2533840194512107e-06
125,135277,135278,B005VOOM4A,A2GL934UT3XENH,"Juli E Ocean ""The SilverPen Reviewer""",1,2,2,1336694400,"Strong Branding, Weak Flavor","I got my box of gourmet Marley Coffee through the Amazon Vine program. I've been a big fan of coffee ever since I had to wake up at 4 am to bus tables at the Ramada Inn Hotel when I was a teenager. Back then, drinking coffee saved my job. In the 30 years since then, I've come to appreciate the multiple nuances about the classic brew. While I don't consider myself a coffee snob, I know what I like.<br />One Love, according to the package, is Organic coffee and Fair Trade Certified, and a piece of the family dream,  which I don't mind standing up for. I still harbor a fondness for the music of the Marley men, and it was with great anticipation that I tossed a pod of One Love into my coffee maker.  For me the coffee was more on the light side of medium. Actually, it tasted on the light side of light.  I prefer a dark bold flavor but don't mind a good medium roast. The package also said Exotic Floral and Berry. Try as I might, I just couldn't pick the Floral and Berry notes or much of a coffee flavor and strangely, no real fragrance. Honestly, I could take it or leave it. I wouldn't recommend this.",1.2193337560357022e-05
1132,173131,173132,B001PMC3LQ,A17INU4IPI2F8M,David Owens,3,5,2,1263945600,disappointed,"My dog loves Newman's Chicken and rice organic dog food, which I have Amazon ship every 2 months. She also loves the Happy Hips brand of treats. I was excited to see Newman also offered treats, so I tried the Salmon and sweet potato. Unfortunately, she does not like this product, probably because it is in biscuit form.<br /><br />Now I somehow have to make her eat these over the next several months, even if I have to grind them up and put in her regular food.",1.2193337560357022e-05
925,567913,567914,B005Q8BP0U,A32OA5XWJK7BHS,Z. Nasser,0,0,1,1349827200,Didn't taste like figs,"Flavor was off, seeds of figs were there but the rests had a processed flavor or was going bad...not sure what it was...but it definitely didn't taste like figs.",1.2193337560357022e-05
794,207730,207731,B00012182G,A4026N9KWSJAE,"Todd Greanier ""Droog""",32,38,3,1312070400,It arrived dead!,"When my bunny arrived, to fill that gaping hole in my soul since my gerbil ran away, I was so excited. I had purchased a wonderful hovel for Prince Hoppy (yeah, I know it is a cool-ass name). I was literally tearing up with joy when I ripped the box open...only to be horribly scarred when I found my new bunny DEAD IN THE BOX! This has ruined me for fluffy pets for life.<br /><br />Where is the quality control? I mean, the bunny was not even fluffy, but looked more like a kidney lying there.<br /><br />Still, kind of a cute little guy I guess and easy to take care of. That's the only reason l gave this three stars.",2.3452707615094163e-05
855,334226,334227,B001HTKZDA,A1V5ZDBBTFJLXR,S. Rajabi,6,6,1,1319760000,Are they kidding??,You can pick up a 2-pack of these Arrowhead 2.5 Gallon waters for $4.49 at Costco and these guys want over $50 ?? What is going on...??,1.2193337560357022e-05
129,239920,239921,B0016BU82C,A2LC1SPAB82IRZ,Carolyn,5,5,1,1301270400,not as good,"I used to buy this at Walmart a couple years ago all the time. They quit having it. I finally found it here. I was VERY disappointed. The company that makes it has changed it. The texture of the bread is different. It is not a soft bread anymore. The taste is different, not as sweet. Taste is nothing like before. I do NOT recommend it and will not buy it any more.",1.2193337560357022e-05
828,130818,130819,B001LUAVQQ,A1VJ8MK4M04TCJ,pat,0,0,2,1339891200,NOT GOOD SOIL AT ALL!!!!WHEN  I GOT THE PLANT LEAVES HAD HOLES!,Ive had this plant a month 32 days) I water it on time about an hour after EVERY water the soil is BONE DRY. I dont think it has very good soil at all when I got the plant it had holes on the leaves brown spots WHEN I GOT THE PLANT Ive did every thing it said about the care for the plant. Thank you Just thought I would Share my info on the plant..,1.2193337560357022e-05
325,111971,111972,B000FAKUPA,A1RRMZKOMZ2M7J,"Sue Katz ""Honey Bee""",5,7,3,1178582400,"Tasty , but salty ... and seem not to last","This is a very nice mix of olives, relatively tasty. But, darn, are they salty! I really didn't expect so much salt for olives packed in oil, and I completely disagree with previous posters.<br /><br />I would not have purchased if I had tasted them first.<br /><br />Also, I've had them about three days -- in frig, sealed, per package instructions. And, I don't think they are going to last. I am already seeing white form on some olives. Yuck. Look to other posts mentioning a similar problem. To Amazon's credit, the refunded the purchase price.",2.3452707615094163e-05
669,25675,25676,B0015R9BQG,A2GQXTYL6DUVBO,K. M. Hicks,0,1,3,1274313600,"A decent vegan snack, tbut with some drawbacks.","The first thing I noticed is that it smells JUST like the canned cat food I give my cat. This was a big turn-off, but I have had good experiences with wheat gluten in the past, so I gave it a shot. The flavor is nice, and has a decent aftertaste. The texture is OK, but not what I would expect from a ""jerky"".. I would have preferred something much chewier. I did eat them, but it's not something I will purchase again.",2.3452707615094163e-05
1357,502527,502528,B0083T5TAQ,A2LFW6MY7K6MLJ,Jodie Mcgovern,1,2,1,1323820800,LAME SERVICE!!!,"I had no idea that I ordered 24 LOOSE Kcups.  This is a gift and it looks stupid...I guess I will put them in a gift bag???  I hope the person has a carousel.  Not impressed, hopefully they taste good.  Some are also dented because there was no padding or protection in the box.  NOT EVEN AN INVOICE!!!!",1.2193337560357022e-05
973,561131,561132,B0006VB3S6,A10QDR3IGAZUYW,SoCalLori,0,0,3,1337817600,Not Everlasting but keeps my dog busy,The first time I used this it kept my dog entertained for hours.  He figured out how to get the treat out of the ball so now it will keep him entertained for maybe 30 minutes.  Really expensive to keep buying these treats that distract him for such a short period of time now.,2.3452707615094163e-05
323,433759,433760,B001LQCOIS,A3KV3KNKOVFEZE,es,6,6,3,1323907200,great device but cleanup can be tedious,"i bought this device over the brezza because the brezza, while able to steam and blend for you, seemed to have a lot of quality control issues.  i didn't want to order the brezza and and have to return it because i got a lemon.  the beaba is very sturdy and the materials feel durable.  it is really easy to make the baby food.  i had to spend about 30 minutes reading the instructions and playing around with the clicking lid and bowl just to get comfortable with it.<br /><br />mold<br />- the reviews made me concerned about mold but i think people hadn't let it dry out properly.  the reservoir is certainly made of ceramic.  after washing it out with water 3 times, i'd flip the beaba upside down to get rid of excess water - not even a drop fell out.  so just make sure you keep the lid off to dry.<br /><br />switch<br />- the blending button has to be manually held down. it's very much like the pulse option on the food processor.  it stops blending as soon as you let go.  the steam option doesn't turn off on its own.  the light simply turns off but you need to turn it off so the heating element turns off.  this can be a pain, like some people commented, but steaming on the stove requires the same oversight and turning off the stove, so it doesn't really bother me. the manual tells you the time.  when you measure the water to 1 - it's 5 minutes; 2 - 10 minutes; and 3 - 15 minutes.  you can set your own timer.<br /><br />blending<br />- i diced up about two slices of potatoes and it was not enough food to blend properly so even though the bowl is small, it makes more than enough a few days.  i don't like to freeze or make food in batches because i think fresh is best and the baby always eats what we're eating anyway. i actually love that it's small and i can only cook a little at a time, unlike some of the reviewers.<br /><br />cleanup<br />- i find this a bit tedious because you have to wash the bowl, the lid, the mixing lid (so food doesnt get in the steaming hole), the basket, the blade, the gasket (every so often), and the spatula.  but every part is necessary and i don't know that it's much different from using a pot/steamer/food processor method. i just like that everything is in one device.  i'll be using this for the next year and a half, and after that, to make applesauce and other fruit/vegetable purees that i can sneak into our food.<br /><br />i really love it and recommend it to people who want to make baby food with one device instead of 3.<br /><br />EDIT:<br />after using it several times, it just isn't convenient enough to be worth 120 dollars.  i kept forgetting to use the mixing lid (so food doesn't get in the handle or steamer) and the motor is not very strong - it sounded like it was going to break down.  i'm just going to use a steamer and a japanese version of the magic bullet, which has a much more powerful motor.  also, having to keep checking on it was beginning to be a pain.  at least with steaming on the stove, you can hear the lid rattling on the pot :)  also, steaming and blending in plastic - no matter how pvc/bpa/pthalate free - made me feel nervous.",2.3452707615094163e-05
70,224005,224006,B004H6MV28,A2FJBCW3QSZ7S3,Stacey,1,3,1,1334102400,no good,"I am a chai tea lover and was excited to see this. After making and trying it with my family, I just don't like it. Very artificial tasting, I'm just not a fan.",1.2193337560357022e-05
128,423107,423108,B005IPJTZE,A3HIVZPHY3S8ZR,"Margie ""Margie""",6,7,1,1325548800,Price is ridiculous!!,"This has to be a joke. Seriously, who on earth would pay almost $2.00 per k-cup (with the shipping)? Not the fault of Swiss Miss which is good but go to Walmart or a local store and get it cheaper!",1.2193337560357022e-05
1058,317819,317820,B005K4Q1RW,A3U3EP6YW692QL,cdsullivan2,5,5,3,1304812800,It's Okay,"Yes, it has the ""fake sugar"" taste, but it's okay.  The real downside to the product is the price.  In a coffee K-Cup, there is more to it than just coffee grounds in the K-Cup...there is a filter etc, and the brewing occurs in the cup.  With these cider K-cups, it's just ordinary drink mix in the K-Cup.  You're better off just buying the powder at the grocery store, and run the Keurig just for hot water, as you would for tea.",2.3452707615094163e-05
1299,525447,525448,B001TM2A24,A35PBTOYQKRI0P,A. Glick,2,9,1,1319846400,bad choice,"Was told by an employee in a pet store that this brand is one of the best. Bought from them and then purchased at Amazon (cheaper). My dog wasn't to happy with the beef selections. After reading the label, realized it was processed in Thailand. Only gave my dog a few cans and then threw away the rest.",1.2193337560357022e-05
1385,48758,48759,B001EQ4ADC,A1NTD5OVB8YYJS,"Conda M Walsh ""Redcwolf""",0,0,5,1270512000,Wonderful Product,"We really enjoyed this product.  It was fresh and tasty, price was excellent.  Great value for dollar spent. We will purchase again.",2.2533840194512107e-06
1123,323691,323692,B003A23HZK,A2TUMS3J8MMCHI,springbrookgoldenlover,4,5,1,1324166400,TOY CAUSED TRIP TO VET!!!,"MY GOLDEN RETRIEVER MANAGED TO CHEW THE CENTER, REMOVEABLE PIECE OFF AND GOT A PART OF IT STUCK IN HIS MOUTH.<br />DO NOT BUY THIS PRODUCT.  GET THE ATOMIC ""MOLECULE BALL"" INSTEAD.  ITS SOFTER AND MORE PLIABLE AND NOT NEARLY<br />AS DANGEROUS.",1.2193337560357022e-05
1306,227640,227641,B001FSJCPK,A1O4D0B2IO2K6T,Jewel Cardwell,0,2,2,1176249600,My cat won't eat them,I had high hopes for this product.  My cat has to take a pill twice a day and I thought I would give this stuff a try.  He sniffs the pocket and walks away.  I even tried getting him to eat the pockets without the pill inside.  He just doesn't see it as food or a treat.  Oh well.,1.2193337560357022e-05
784,356361,356362,B003SSWCJI,A2TMTQVLROY5RI,suzan,0,0,3,1329696000,I am not sure if it has helped me,"I have purchased this product due to its amazing reviews.  I have been having horrible health issues that started after taking a diet pill which has caused me drastic changes to my health.  I have been having issues with my digestive system, emotions, IBS, I never had heartburn now I do, I have cracked tongue, dry tongue, metallic taste in my mouth, I dont digest well my food.  I have done too many tests and nothing has been coming up but only GERD and have taken so many treatments for this but nothing helps me. :(<br /><br />I thought maybe this would help me but I dont see any change in anything.  Its been 5 days since I started.  I started with half teaspoon in morning and night, and then after a day did 1 tsp twice a day, then did 2 x a day but started to have diarrhea so now I am back to 1 twice a day.  I do not see it has made any changes, maybe it takes time, we will see.<br /><br />The delivery was fast taking into consideration I live in Doha, Qatar. and the package was in good condition.<br /><br />Will keep updating.",2.3452707615094163e-05
177,308097,308098,B001AWBROK,AHWRE54C5EJIJ,Robert Whitaker,1,2,3,1325116800,Great dinner but horrible price!,My twins love this!! BUT Walmart sells them for $1/ for a 2pack!  Worth going there to save the extra $!,2.3452707615094163e-05
598,116628,116629,B002YJ0118,A28SPU7JW99J3E,"Michael A. Pengilly ""mbikes""",0,1,3,1234742400,high price,price went up too much i think i will go to sams club from now on,2.3452707615094163e-05
1127,449664,449665,B001D0GVAO,A3D7O93PPYVF65,B. Terrell,1,1,5,1267488000,Best decaf I've ever had!,This is the best decaf!!  I cannot have caffeine but I love my morning cup of coffee so I've tried many kinds.  This is my favorite.,2.2533840194512107e-06
896,44182,44183,B0007NOWMM,AYK10WF7H2ZBM,"Ann M. Schmidt ""Betty Booper""",0,0,5,1168128000,Great Tasting Coffee Pods!,"I don't hav a senso, but I just place the pod in my cup with hot water, and it works great? or I will use the pod in my regular coffee maker, as I don't like real strong coffee, this works great too.  Would recommend to all coffee drinkers!",2.2533840194512107e-06
313,312751,312752,B000EZMRPM,A2FM60CO98HMFX,Lizzie,0,0,3,1306281600,"Yeah, it's definitely chewy","But, knowing that, I just bought an eight pack of it anyway. Here's my advice: rip open a package, pour it out on your cutting board and cut it into bite size pieces with your kitchen shears. I find even the toughest pieces manageable after that.<br /><br />Still--the first time I bought it (at a Whole Foods), I happened to get a package that wasn't as tough. So I agree that the quality control could be better. And some pieces seem nicely seasoned while others feel a little like eating leather.",2.3452707615094163e-05
418,561461,561462,B002RX7X7G,ADUPPD2TM5AML,MargRN,4,4,5,1264896000,Amazing!,"These are fantastic!  No grittiness whatsoever. Great chocolate flavor - taste exactly like you remember a brownie being!  I've made these and shared them with non-gluten free relatives, and they did not have any idea that they were gf.  So nice to get a boxed mix that actually makes a family sized portion!  They come out nice and chewy, and remain that way for at least a day.  I can't vouch for anything longer than that, because I can't keep them around the house any longer!  They disappear VERY quickly!!<br />Thanks Naomi, for another job well done!!!",2.2533840194512107e-06
827,177513,177514,B004U49QU2,A14J4V61SWEOGU,"Mandy ""Mandy @DailyCupOfGrace""",0,1,1,1308787200,Homemade Are Better,"I know some would say that ""homemade are better"" is a no-brainer, but I happen to think that some store bought cookies are just fabulous!  However, these are not in that category.  They were dry - far from being gooey - and quite tasteless.  They are also really small so it was not like you could lay them out on a plate and serve, they are more of a pop-in-the-mouth snack.  I personally would not get these again.<br /><br />This review is through the Vine Program.",1.2193337560357022e-05
644,247707,247708,B001E6GFZI,A38WF1M8H8QS4B,Mapsman,3,4,1,1320451200,No Longer a Good Deal,"When I first signed up to buy this product through the subscribe and save program, it was a great deal averaging around $3.00 per box vs. $5.00 in the grocery store, but Amazon cancelled that subscription saying the product was no longer available through the subscribe and save program.  The price that's listed here is ridiculously high.  Unless you are in an area with no grocery store, why would you pay this exorbitant price?",1.2193337560357022e-05
1390,26846,26847,B001EO7I38,ATMDVKBZYNKND,moderatelymoderate,2,2,2,1322006400,from China!!,"I expected any canned stuffed grape leaves to be oily & they are [6 oz oil, 4 lbs stuffed grape leaves].  What I  DID  NOT  expect was for the cans to come from China.  Like most other Americans I get many things that are made in China, but I draw the line at food.  Their safety standards are low at best.",1.2193337560357022e-05
522,97571,97572,B000Q6R3SK,AIENELMK2AEMH,"Sam D. Maloney ""oruboris""",1,1,1,1295222400,Don't waste your time,"Nearly tasteless... there is a faint bit of musky saltiness, but no real flavor. The same amount of money will buy enough truffle oil to flavor a dozen dishes.<br /><br />At least the jar is cute!",1.2193337560357022e-05
69,470577,470578,B001LUM1ZU,A1DS0E53UXPE8Z,Skip,2,3,1,1265846400,We are open minded but this doesn't taste like bacon or even close.,We were hoping to like this fairly pricey product but warm or cold we found it unappealing. Thankfully we just purchased 1 jar. We would have been happy if it didn't taste like bacon but was tasty just on its own merits. But it isn't something we would put on anything. Our advice save your money and get some real bacon:),1.2193337560357022e-05
1465,212123,212124,B000CNB4LE,AEZGGP7ZLC548,"James L. Dietz ""Dr. D""",3,7,2,1221782400,Dr. D,Not as tasty as the mango or even the plain... flavors are very muted...and I didn't get a hint of passion fruit.. too bad,1.2193337560357022e-05
607,526765,526766,B001FA1L8O,A36HAWOP5ZG4MT,Amy Liz,2,2,3,1211673600,Pretty Good Waffles,"This mix makes nice crispy waffles but the flavor was surprisingly bland.  Next time I make them I'll throw in a tablespoon or two of sugar and see if that helps.  I was hoping for a mix comparable to Bellegem and this is not that mix. If you're looking for waffles with amazing flavor, you should pass this one up and try Bellegem instead.",2.3452707615094163e-05
763,411189,411190,B003N4PADC,A3BP6VZX5YZRZ,Bruce Dixon,0,0,3,1332979200,Too sweet for me.  Wish they offered it un-sweetened,The basic flavor is nice but it is too sweet.  I think it should be offered in a non-sweetened type.  Otherwise its good :),2.3452707615094163e-05
1427,152756,152757,B001S1BP5O,A286R5JRL19S6Z,ishtare,0,0,3,1327017600,Fazer Milk Chocolate with Hazelnuts,"I tried this a few years ago, and thought it was great.  It's certainly much better than chocolate from your local grocery store.  Recently though, I've tried Ritter Sport, and have decided that it's better.  So for those of you who are looking for something that's better than what you can get at your local grocery store, you're definitely in for a treat with this, but you might want to  give Ritter a try also.",2.3452707615094163e-05
1133,489599,489600,B0029XDZDK,A388BCLXV6H9YD,"Petit Oiseau ""farmer's wife""",5,5,3,1275350400,"Ok, but not the best I've tasted","Black Tiger makes a good cup of coffee, but not great.  It's got a bit of a bite and could be a little smoother.  I really enjoy a rich, robust coffee and was hoping for that according to the name--just a bit disappointed.  I have found Timothy's Rainforest Extra Bold Espresso K-Cup a much more satisfying cup.  The 50 pack in the simple brown box, though, is a great idea--there's enough waste with the K-cups that the simpler the outer packaging, the better.",2.3452707615094163e-05
955,58206,58207,B003Y3NOP8,A2JLG97160BGRR,Kyleigh,1,1,3,1342828800,its alright; son didn't like all the meat ones,"my son liked the oatmeal and fruit ones, but gagged with the meat ones. thats ok though, I think any jarred smashed meat is probably disgusting. good packaging, fast arrival.",2.3452707615094163e-05
346,82771,82772,B0049K99RW,A1Y73Y4VX3AJMZ,Rispir Chrone,0,0,4,1351209600,Nice traditional chai,"I got hooked on this chai when I decided to give up coffee.  It still has a little bit of caffeine, but much less than coffee does.  It's nice and spicy (you really get the flavor of black pepper) and actually easy to prepare.  Initially, I thought it was too complicated to boil water and then add milk separately, but it allows you to adjust to your own tastes.  I usually add a little more milk than instructed to cut down on the spice and add a little more creaminess.  The thing I really like about this chai mix is that it's not sweet at all.  If you want sweet, you add your own sweetener - I usually use a spoonful of white sugar or honey.  After drinking this stuff, I tried some pre-sweetended mix, and there was no comparison.  This stuff tastes ""real"" and without chemicals or preservatives.",2.2533840194512107e-06
917,329206,329207,B003VXHGE6,A1WH998KDXZB7A,H. Drum,0,0,3,1292457600,It's okay but I won't buy it again.,I like bold coffees and should have trusted the other reviewer who said it wasn't strong enough. This one has a watery finish to it and not very much flavor.  I'll be going back to Emeril's Jazz'd Up Decaf and trying the Coffee People's French Roast Decaf.  So far I've loved everything by the coffee people except the organic blend.  If you like strong coffee don't buy this but if you like a weaker coffee that you can see through you'd probably enjoy this one.,2.3452707615094163e-05
142,272261,272262,B0029O0HZS,A3MNL5YQL3F4ER,ashes72484,2,6,1,1300147200,Cat Killer!,"I fed this to my three cats. Within a month one of them began getting sick, throwing up his food once a day then every meal. Eventually he began throwing up blood and was passing it from his bottom. We thought he was going to die, these symptoms all happened over a few days time.<br />We took him to the vet, they ran tons of tests found nothing wrong and gave him a hydration IV and sent him home with instructions for a diet of puree chicken and rice. Days later we gave him a little bit of the dry cat food with his special food. Hours later he was terribly sick again. It was then that we realized the food made him this deathly ill!<br />DO NOT BUY GOODLIFE it almost killed our cat!",1.2193337560357022e-05
