,num,Id,ProductId,UserId,ProfileName,HelpfulnessNumerator,HelpfulnessDenominator,Score,Time,Summary,Text,weight
1439,539727,539728,B001JDHUUA,A3RE7D0ZM3I0B3,"Muriel J. Young ""amazon lover""",0,0,3,1350604800,if ya like it,"bought this for my son because he was curious about it (due to a song from Men at work). It is SALTY. so if your blood pressure is high, dont try it. I guess its ok if you like it but we don't<br /><br />Y",2.3452707615094163e-05
1482,337201,337202,B000SU201O,A15VQV6ABE5M4C,Elwood Caudill,1,1,3,1236124800,This Stevia Powder doesn't desolve well in cold liquids.,"The pure product while being much more stronger than sugar, is ""cut"" down in strength to that of sugar packet strength.  The result does not desolve well in cold liquids.  The has a more pronounced and unique flaver than sugar which enhances the taste to whatever you put it in.<br />The NuNaturals stevia packets sold in Vitamin Stores desolves better but is 3 times more expensive.",2.3452707615094163e-05
373,148497,148498,B003JA5KLM,A37YG52WY9672Z,PamelaC,0,0,1,1347408000,Order arrived promptly filled with EMPTY k-cups,"Was pleased with the packaging and prompt delivery however EVERY SINGLE PACKAGE WAS EMPTY.  No coffee inside.  No broken seals or holes, just nicely sealed empty k-cups.  Would like coffee with my coffee",1.2193337560357022e-05
405,250316,250317,B001NXHY8Y,A30SW8TWRSVR01,Sara Carter,0,0,3,1265587200,"I love HappyBaby products, just not *this* one.","The banana flavor is by far better tasting than the greens or apple flavor. My baby would rather eat Cheerios, unfortunately. I couldn't get him to eat these after trying and trying and ""COME ON THEY ARE ORGANIC AND I PAID GOOD MONEY FOR THESE!"" and trying. Very disappointing. He did like the banana better than the other two. I disagree that they taste sweet. I really they think they taste bland. My son *loves* the HappyBaby Yogurt Melts,though.",2.3452707615094163e-05
507,75757,75758,B004MO6NI8,A37071Q86HR6FU,Alan Hawkins,0,1,3,1331683200,ok i guess,"drink was ok I guess, didnt taste all that great, not sweet enough for energy drink. didnt notice alot of energy effect.",2.3452707615094163e-05
1020,535025,535026,B005PXZ6JM,A2ADN5XZJ6VQ39,E. Bullock,0,0,3,1341100800,Love them but...,"I really like these bags. They're super durable, but thick and pliable. I bought the 50 pack to try when my baby was first born. I got through the first 25 and loved them. But after about the 5th bag in my second set of 25 they began to leak badly at the bottom. I had pumped 4 oz and put it in the bag, as usual, and it began to drip. My hubby quickly got out another bag and we transferred the milk and that one also began leaking. We poured the milk into the bottle because obviously it wasn't a one time deal. I put water in 4 more bags and realized they were ALL leaking. I looked in my freezer to make sure they hadn't leaked without me knowing it and there didn't seem to be an issue. I called the company and made them aware and asked them if they could replace the bags. They were VERY nice, took my address, phone number, and said they'd send me 100 new bags and to return the leaking bags so they could examine them. Sweet! Well, that was 7 or 8 weeks ago and I haven't seen or heard anything and have never received new bags. So, Lansinoh bags are my new friend. They're similar enough, but I'm bummed because I really did want to LOVE Honkeysuckle.",2.3452707615094163e-05
210,146851,146852,B007A9WEAS,A1RILURU1KYEO3,drycroft,3,4,1,1333324800,Brach's Easter Hunt Eggs,"I have looked all over for these delightful easter eggs for my grandchildren for a hunt this Sunday. But, you can believe me, I won't be buying these!! What a disappointment for me and the children. This is as bad as gas, it's price Fixing. Shame on you Brach's.",1.2193337560357022e-05
951,209292,209293,B000QCOALC,A2FY7V2ZBMNPHH,tmnewm,4,6,1,1288828800,This is not an actual case - Loose sachets were delivered in a postal box,"I ordered quantity 2 of this item.  The Nutella sachets came loosely packed in a postal box.  There were 72 of them (2 cases worth), but I had to count them all to determine whether I even got what I paid for.<br /><br />I thought I was ordering two cases as illustrated in the photo but my shipment did not include the Nutella branded box which appears in the photo.",1.2193337560357022e-05
74,253342,253343,B004JRMG98,A3LOGP4VA9DX46,Prism,0,1,3,1314057600,"Yowsers, high fat but it is tasty","This Taco Bell Jalapeno sauce is VERY good!  As for taste, it is excellent. But usually taco sauce is low or no fat but this is sauce is extremely fattening so I won't be buying it.  I believe for 2 tablespoons, it is 110 calories and 100 of those calories come from fat. That's so high! It has a buttermilk base so it has the texture and fat content of a buttermilk ranch salad dressing.  The nutritional value is a dealbreaker for me but if that's not important to you, then you'd love this sauce if you like spicy condiments.",2.3452707615094163e-05
1280,236274,236275,B004051BLS,A299RHMH1M9PIW,Moderate Risk,0,0,3,1300579200,Another Take on Mint,"You might think I wasn't too thrilled when you see three out of five possible stars. This is, however, a truly delightful mint tea. There are so many varieties of mint tea out there that this didn't seem to me a groundbreaking new tea release. The idea of a revitalizing mint tea is rather original. If that is what you are looking for you can knock this rating a star or two higher. Of course, in my personal opinion, mint is a tea for relaxing rather than revitalizing. That is my opinion. I do enjoy the taste of this tea which isn't completely a pure mint flavor but rather a ""minty"" flavor.  If you like mint tea you will enjoy this tea as well. Yogi's quality is well known. If you are looking to revitalize, so much the better. This guy is looking to relax. It's just a personal preference... truly.",2.3452707615094163e-05
1353,196502,196503,B003L7JO9C,A1HL2GTRYFVIVP,"Chet ""ChetBooks""",2,2,3,1303689600,Just OK,"I bought this when I ran out of an exotic seasoning called ""Salt-n-vinegar"" that I used on popcorn.<br />This really does not have any salty flavor to it...basically it is finely ground  vinegar powder.",2.3452707615094163e-05
652,435588,435589,B000HDI5O8,A1ZWJJE8I7ZT4U,"James Miller ""jamesjm""",11,17,1,1288569600,Organic but may contain BPA?,"I purchase a variety of organics for my family to minimize the chemicals, herbicides, pesticides and fungicides.  Apparently, organic certification does NOT include the restriction of BPA or Bisphenol-A. BPA is in many canned foods including this canned organic pumpkin manufactured by Farmers Market as of April, 2010. Read about there acknowledgment.<br /><br />BPA has recently been banned by New York State for products intended for children. With that said, do the homework.<br /><br />[...]<br /><br />[...]",1.2193337560357022e-05
845,184944,184945,B000F17AKC,AHF67Z2TYMA2O,Coldsteel7,3,3,3,1300492800,"Trung Nyguyen - Decent Vietnamese Coffee, But I Prefer Cafe DuMond.","I like a good cup of Vietnamese coffee.  I use either a coffee press or a Vietnamese filter depending on how much of a hurry I am in.  I have two boxes of Trung Nguyen coffee, which I don't really use.  The coffee is a little bit bitter for my taste.  While the bitterness of Vietnamese coffee is cut by the sweet silkiness of sweetened condensed milk, this coffee bean is still manages to bite.  Fixing the coffee with Cafe DuMond provides a rich experience without the bitterness.<br /><br />I can get Trung Nguyen at an International market near my house.  However, if you buy it online, expect to pay excessive shipping charges.  Before this store opened, I had to pay nearly as much for shipping as the actual coffee.  So a ten dollar box of coffee will set you back another ten for shipping.  Ridiculous.  Be aware of that if you decide to order online.<br /><br />The cost of Trung Nguyen is actually pretty good compared to most other specialty coffees (when you don't have the shipping component).  I can get it at my local market for $6.99.  The online prices normally range right around ten dollars.  Any good coffee brand is going to run around ten dollars per pound.  This brand is just shy of one pound, at fifteen ounces.  The seven dollars I pay locally is a steal.  It is just too bad that the bean bites more than I like.<br /><br />Trung Nguyen is excellent if you like to fix Vietnamese coffee.  I you enjoy a bean that has an extra bitterness, then this is just right for you.  It is a mixture of several beans, which is a by-product of the micro-climates that affect growing in Vietnam.  If you like something a little milder, use Cafe DuMond.  The chicory adds a pleasant chocolate quality without the harshness.  Three stars.",2.3452707615094163e-05
1379,487254,487255,B000PDWBKO,A2JYHJEL41V8NW,Karen Beck,2,2,3,1296172800,Salty - but and easy fix...,....we found this popcorn to be too salty....so now I snip a tiny corner of the package before putting the popcorn into the popper and let most of the fine salt drain out.  That works just fine...and the popcorn tastes pretty darn good....,2.3452707615094163e-05
931,91408,91409,B003OB6BWI,AXYESYR1GNGM0,DavisJes,0,1,3,1334707200,eh,This was not a great as I thought it was going to be. Like the lime shrimp it seems a little bland but then again nothing has the strong amount of flavor the beef ramen has. I have only had this once or twice.. I will try this again though to see if the second time it is better.,2.3452707615094163e-05
603,491088,491089,B003EMSVJ8,A7QZ3NG2GL2CL,Autumn,0,0,3,1297987200,Kinda dissapointing,"I LOVE gummy candy and find it hard to resist the classic Haribo Gummy bears and I regret straying from them to try these. the flavors aren't very distinct and area all kinda icky The strawberry and orange are very bitter, the lemon tastes like pynsol smells. the only one I cant really complain about is grape.",2.3452707615094163e-05
1488,175264,175265,B0012NUVN0,A3CWZTAEAHQMTS,J. Cox,0,0,2,1346630400,Gone in 5 minutes,My dogs can remove the insert and scarf it down in 15 minutes.  Too expensive for 15 minutes of entertainment.  I made some toys out of old tennis balls that keep them entertained longer.,1.2193337560357022e-05
693,247017,247018,B002ZJSS8A,A2X8URSBQ7D4IJ,Snowycat,0,0,2,1320105600,Not The Best Cookies I've Ever Had!,"I was sorely disappointed in these cookies.. They are pretty tasteless and damn hard too.. I wouldn't buy them again and I've certainly tasted much better low-cal cookies.. I definitely recommend saving your money, folks..",1.2193337560357022e-05
430,29204,29205,B000PDY3P0,AU8C0E965U2QI,A. D. Miller,2,3,3,1262736000,"Good movie style popcorn, a bit salty",These packets are easy to use. Not the most healthy thing in the world. Very salty. Sometimes too salty for my taste.,2.3452707615094163e-05
292,20295,20296,B001BDDTB2,A12XHPZ1GIWG8T,Kaydee,0,0,3,1228435200,One Cat Liked it and One Cat Hated It,"One of my cats liked this food, although not as much as he liked the Petite Cuisine Seafood Variety Cat Food, and my other cat wouldn't touch this food; however, she does like the Petite Cuisine Seafood Variety. This variety of food comes with chunks of chicken, chunks of vegetables and gravy. I'm guessing my finicky cat was turned off by the vegetable chunks. On the positive side these cans are easy to open and you can pour the food out without having to use a spoon. However, because one of my cats wouldn't touch this food I won't buy it again. I'll stick with the Petite Cuisine Seafood Variety Cat Food.",2.3452707615094163e-05
45,158324,158325,B002QTWU4W,A10YMDRAAMISIF,JSWilliams,0,4,3,1297900800,"Annie's Homegrown Cheddar Organic Snack Mix, Bunnies Cheddar, 9-Ounce Boxes (Pack of 4)","My son LOVES these, but they are SO FUNKY.  His breath STINKS after he eats them.  Not sure why that is; he has had the regular cheese bunnies before without an issue.  These smell like old pepperoni pizza.  Good out of the box, gross on the breath.",2.3452707615094163e-05
1240,68514,68515,B000LNQP3W,A1N0SNIGGRTY76,Jasper Nance,0,0,3,1276473600,Mild!! yeah right!,"I am NOT friends with spices, but I love Indian food. Its a complex relationship. So when I read MILD on the package I thought, hooray! Yea right, I am eating it right now and between 5-minute spoonfulls my face is melting! DO NOT trust the mild rating, this is crazy hot! best with rice which helps to quiet down a funny aftertaste that is no doubt a byproduct of the ready-to-eat technology. Not a big deal anyway.",2.3452707615094163e-05
1218,148922,148923,B004Q3LBTG,A3EFZR60LBUW0K,Dedicated mom,1,2,2,1339113600,Disappointing,"The product worked fine for the first week, but by the second week I found excessive water leaked into the bottom of the machine and onto the table after steaming the food. There were numerous cracks  with the plastic container! I presumed the container could not withstand the vibration from the blending motion. I called customer service and am now waiting to see what they can do.",1.2193337560357022e-05
861,523907,523908,B004JGQ15Y,A35BVGH5X6Z4QH,Marino Shauye,0,0,3,1300924800,Not what I expected.,"This might sound weird, but if these cookies were marketed without the Oreo name, they might taste better. Or, if they were called ""Oreo Crisps,"" I wouldn't have been hoping for that classic Oreo taste.<br /><br />My first impression was that these are ""weak-sauce Tagalongs"" (Girl Scout cookies). They're thinner, and don't taste super peanut buttery. The package clearly says ""Peanut Butter"" with ""Creme"" in small letters next to it, so I've theorized that the ""creme"" part means it's the familiar Oreo creme that has *some* peanut butter flavor added.<br /><br />The cookie texture is nice. Very crisp and tasty. It's just when everything is put together that it's kind of disappointing. I have hope for the original flavor, <a href=""http://www.amazon.com/gp/product/B003XV1TAS"">Oreo Fudge Cremes, 8.5-Ounce Boxes (Pack of 4)</a>, but have yet to try them.<br /><br />That said, I do keep eating them. They kind of grow on you, but they're not as amazingly delicious as I like my snacks to be. I think I'll stick with regular sandwich Oreos.",2.3452707615094163e-05
359,89403,89404,B0014WYXQK,AFLPMS5K3DZL5,calmly,3,3,3,1209772800,Okay,"I've tried both the pomegranate and the blackberry. Of the two, I prefer the pomegranate.<br /><br />I don't mind that is only 70% juice, that seems fine and they seem sweet enough. But, unlike the 100% sparkling grape juice I have had in the past, these two Izze flavors leave my mouth feeling somewhat dry...in a way I have not experienced with other drinks. These 8.4 fl.oz. cans contain Izze Fortified which means fortified with 10% of the USRDA of Vitamin C, Vitamin 6 and Niacin. It appears from the Izze web site that Izze in 12 oz bottles is not fortified so I might one day want to try the non-fortified Izze and see what that is like.<br /><br />However, the 100% sparkling grape juice I can buy locally, although it comes in a much larger bottle so may not be as convenient, seems more economical so, if I wanted a sparking juice, I'd probably buy that instead. Or I might sometimes, but not often, want a sparkling water. But usually I am more than content with tap water. If I want fruit, I can alway eat fruit.",2.3452707615094163e-05
834,88839,88840,B003OB2DSE,A2FYA92GJ36O6T,Na.Tion.Panda,0,0,3,1339891200,Not exactly 'the ramen' that you want.,"I loved spicy food. When I saw this, I thought I'd give it a try. It turned out to be less than good. The soup taste pretty plain, and the noodle doesn't taste as good as other $50 cents noodles.",2.3452707615094163e-05
1444,224433,224434,B000EQT574,AV8HGBJ1OORNF,Mrs. Murphy,0,0,5,1255132800,Love these chips!,"These chips are great. I love the hot and spicy seasoning. They are too spicy for my 5 year old, but my 8 year old loves them also.",2.2533840194512107e-06
791,335191,335192,B003D4MW38,A1TCOHXK2VRDJL,marcus102692,0,0,3,1317168000,Decent Product,"The taste of the product wasn't quite what I thought it was going to be. There is definitely a strong coconut taste that overpowers the mango taste. I expected more mango in the equation. However, with all expectations put aside, the tea is good.",2.3452707615094163e-05
736,182012,182013,B0009F3POY,AIK4WM0VZ5R0F,Bebe,3,4,2,1310774400,Stuff tastes vile,"I don't know if it increased my milk supply because it was so disgusting that I could only stomach it a few times.  I suppose if you are desperate, but I would go with the fenugreek and blessed thistle  pills.  You have to take a lot of the pills, like 9 per day but at least I could manage to take the pills.  This stuff I had to force myself to drink, and it smells awful too.",1.2193337560357022e-05
33,550851,550852,B005BSPOHU,A2MUGFV2TDQ47K,"Lynrie ""Oh HELL no""",0,0,2,1339459200,"Price is Decent, Product IS NOT!","I used to buy these BOLD Espresso Dark Roast Pods from Starbucks; enjoying BOTH the flavor and buzz. These pods are very MILD, nothing BOLD to be found with them, I'm on my 3rd pod today awaiting the buzz. These are NOT expired until 11AUG12 so I suspect although the box indicates BOLD these are mislabeled and really are MILD.<br /><br />I called both Amazon AND Starbucks to share my comments about this purchase. Both are pleasant but have nor rhyme or reason for these pods ""missing the mark"".  This definitely is not recommended!",1.2193337560357022e-05
103,95426,95427,B00395DVWM,A11SS70C5XUCDM,Susan A. Fay,0,0,4,1303171200,Pecan coffee pods,This coffee is very good. A little strong for my taste but I mix it 1/2 & 1/2 with regular coffee.,2.2533840194512107e-06
968,285887,285888,B005BCHI6Q,A2OUZAY92TFM70,"J. Lilly ""JSailor""",1,2,1,1324512000,"""Ordered Soon"" But Never Shipped","Liquid Nation said, order soon as their stock was low. Wellllll, I did order and almost two weeks later, they do not know when it wll ship. BTW....The page still says ""Only 4 left in stock--order soon.""",1.2193337560357022e-05
714,521246,521247,B000Y0M2NO,AF6MP20RXGN2J,NORMS09,4,5,3,1304899200,not bad,this stuff does what it is suppose to do but not much in the bag for the price.  i think i will start making my own,2.3452707615094163e-05
556,301466,301467,B006W6YHHI,A30QSFDSZ3YHNA,Luvdgame,1,1,3,1342656000,"They do work, but this isn't a good deal","I bought ""Greenies"" after hearing rave reviews about them from friends. I buy all my pet supplies on Amazon.com and was able to purchase the value pack 36oz container when on a lightening deal ($22). My dog loves them, but she eats anything - I do think they help with tartar and her breath. My reason for 3 stars is because I don't feel like it is that good of a deal. There are not that many chews in the box and I thought I was getting a steal on them when I did. No one in their right mind would pay $130 for this container, I think even $35 is a ripoff.",2.3452707615094163e-05
469,106450,106451,B004P8JNCO,A2FW8AXHIXCP92,vick,1,1,3,1325289600,I want my cats to like this so badly!!,"Healthy catfood is really important to me; I've got one cat that has wheat/corn sensitivities and another that's just super high energy and needs food to match.  So I""m constantly searching for food that's (a) corn-free and ideally free of all grains, (b) high meat content and ideally ""good"" meat not castoffs, byproducts etc and (c) not going to completely bankrupt me.  Oh, and of course....that my cats will actually eat. Sigh.<br /><br />This sort of meets the mark....my cats hated this food though at first.  Would NOT eat it.  Over time, they are getting better, but its still not their favorite and sometimes they will totally reject it.  It's also not all that cheap.  I really want to like it, because it's got great ingredients and I know it's good for them...but I can't rate it as highly as I want to because if they won't eat it consistently, it does me no good.  Wasted expensive cat food = bad.",2.3452707615094163e-05
15,469489,469490,B001BKNBTK,A29S4OB7TZ7GGX,"Susan Payne ""Susan Payne""",1,2,3,1241308800,"Castor & Pollux Organix Feline Formula, Organic Turkey Formula","The ingredients are wholesome, but pricey.  I have four cats (unrelated, in case 'taste' runs in a family), and none of the four find it appealing.  They will eventually eat this food, but clearly wish for another instead.",2.3452707615094163e-05
278,62888,62889,B004OV6X6Q,A3VGAP2KLCBNBB,"Amy ""epiamy""",0,0,3,1311811200,Not bad for a vegan gluten free bar,"With a consistency like a Little Debbie Brownie and a taste like the no-Pudge brownies, these will not be for everyone. However, if you are on a restricted diet (no soy, no gluten, no dairy), these bars fit the bill. They are not overly sweet, although there are 25g of carbs in each bar. The main ingredient is dates, so that is what provides the majority of the texture. The bars soft and dense, sweetened with agave nectar with no other sugar added.  It does contain 5g of fiber and 7g of protein, but only has 10% iron and 4% calcium RDA.<br /><br />My biggest issue is the calorie impact: at 190 calories, I want something that has a little more flavor, especially if there is little added nutrition (these can't be used as meal replacement, just as an occasional snack). The wrapper says ""Your chocolate prayers have been answered."" I seriously doubt anyone eating this bar would agree with that statement.",2.3452707615094163e-05
1258,92643,92644,B001AHJ2D8,APZWKX3F1YX37,JAG,0,1,3,1226448000,"No Rating, No Comment","I have to write a review in order to get this off my 'Vine Voice' list.  I never recieved the free sample.  According to the tracking number, it ended up being delivered to the wrong town.",2.3452707615094163e-05
860,345125,345126,B0076MLL12,AUAT8KNYH4RAM,"T. torrez ""Kat""",1,2,1,1325635200,"Not bad, but not good either","When I got my Keurig I fell in love. I bought a bunch of different sample packs and two boxes of the grove square hot cocoa. I'm a bit of a hot cocoa nut, partially because I can't have caffeine, and partially because it brings back wonderful memories of playing in the snow and the fun of warming up afterwards. I really wanted to love this hot cocoa. I tried all three flavors multiple times, in different ways. I tried them on the different cup sizes, adding things, etc. There's just this strange taste to them that doesn't sit well on the tongue. I'm not sure what it is, but it has a faint ring of sour milk. It really lingers, and I haven't found anything that takes the taste away. I'm going to give my second box to a friend, she doesn't seem to notice it. My daughter and husband both said it tasted weird, so it's not just me. I also took it to a friend's house and have tried them in three different Keurig machines, JUST to make sure mine didn't need to be descaled. So I guess my suggestion is to try it before you go for the multiple boxes.",1.2193337560357022e-05
1232,514702,514703,B0037MVZY8,AZWRZZAMX90VT,Rennie,1,1,3,1298160000,"Cinnamony, not as good as the peach or strawberry ones","So I love the strawberry Honey Bunches of Oats. I'm not a big cereal eater but I love that one. I discovered the peach one last year and love that one too. So I thought I'd try this one because hey, I love pecans.<br />Nope. This one has a cinnamon flavor to it and I don't like cinnamon. Most people seem to so you may, but just know that this one has a different flavor to the cereal.",2.3452707615094163e-05
989,339432,339433,B005A1LJ04,AQAT7HWPDXACL,"S. Watkins ""swatkins01""",0,0,3,1332374400,Tastes OK - Just not much like a Margarita,"This tastes OK - like a non-specific flavor of tropical fruit drink. However, it is not a substitute for actual Margarita mix.  If you want the Margarita taste without the alcohol, I recommend adding some ginger ale or similar drink to regular Margarita mix.  The point of this Crystal Light mix is to have the taste without the alcohol OR calories, but it does not quite hit the mark.",2.3452707615094163e-05
1158,36274,36275,B0036ZGPGO,AAGC8PMQ0RDTT,Sue LeBlanc,0,0,2,1349222400,Turkish Sweet Turnip Juice (Salgam),"This product arrived as a birthday gift.  After chilling it as instructed, I attempted to drink some.  The first thought that came to mind as it hit my palate was sea water.  Salty!  Then lemony sourness followed.  Not a sugary taste that I was expecting.  No this does not taste sweet at all and had the sourness approaching that of a lemon.<br /><br />It has a strange but interesting aroma that is not at all bad.  In fact I felt drawn to smell several more times trying to put a name on the unexpected yet familiar complex aroma.  It reminds me  of a bologna sandwich on white bread with overpowering hints of celery.<br /><br />If you are not used to this kind of drink, I will say that it is probably much more of an acquired taste.<br /><br />From Wikipedia:<br />&#350;algam is a popular beverage from southern Turkey's cities of Adana and Mersin. Although the Turkish word &#351;algam literally means ""turnip,"" &#351;algam is actually made with the juice of red carrot pickles, salted, spiced, and flavoured with aromatic turnip (??elem) fermented in barrels with the addition of ground bulgur. It is traditionally served cold in large glasses with long slices of pickled carrots, called tane (or in some accents, dene.) Hot paprika relish is added just before drinking. Hot or regular, it is a popular drink with Adana kebab.<br />&#350;algam is often served with rak&#305; (alcoholic beverage)--not mixed, but rather in a separate glass. While &#350;algam is commonly used to cure hangovers, consuming excess amounts may cause bloating.",1.2193337560357022e-05
